{
  "set":"EX", "number":"2", "name":"Coin Flip", "supertype": "Pokemon", "tags":[], "stage":"Basic", "hp":60, "types":["Colorless"], "retreat":1,
  "attacks": [
    {"name":"Flip", "cost":[], "damage":0,
      "effect_ast": {
        "op": "FlipCoins",
        "count": 1,
        "on_heads": {
          "op": "DealDamage",
          "target": "OppActive",
          "amount": 20
        },
        "on_tails": {
          "op": "NoOp"
        }
      }
    }
  ]
}
